
*** Running vivado
    with args -log multiplier_toplevel.vdi -applog -m64 -product Vivado -messageDb vivado.pb -mode batch -source multiplier_toplevel.tcl -notrace


****** Vivado v2022.2 (64-bit)
  **** SW Build 3671981 on Fri Oct 14 04:59:54 MDT 2022
  **** IP Build 3669848 on Fri Oct 14 08:30:02 MDT 2022
    ** Copyright 1986-2022 Xilinx, Inc. All Rights Reserved.

source multiplier_toplevel.tcl -notrace
Command: link_design -top multiplier_toplevel -part xc7s50csga324-1
Design is defaulting to srcset: sources_1
Design is defaulting to constrset: constrs_1
INFO: [Device 21-403] Loading part xc7s50csga324-1
Netlist sorting complete. Time (s): cpu = 00:00:00 ; elapsed = 00:00:00 . Memory (MB): peak = 1661.344 ; gain = 0.000 ; free physical = 5469 ; free virtual = 10985
INFO: [Netlist 29-17] Analyzing 45 Unisim elements for replacement
INFO: [Netlist 29-28] Unisim Transformation completed in 0 CPU seconds
INFO: [Project 1-479] Netlist was created with Vivado 2022.2
INFO: [Project 1-570] Preparing netlist for logic optimization
Parsing XDC File [/home/ece385user/Documents/ece385/lab4/lab3.srcs/constrs_1/imports/pin_assignment/top.xdc]
WARNING: [Vivado 12-584] No ports matched 'sw_i[15]'. [/home/ece385user/Documents/ece385/lab4/lab3.srcs/constrs_1/imports/pin_assignment/top.xdc:1]
CRITICAL WARNING: [Common 17-55] 'set_property' expects at least one object. [/home/ece385user/Documents/ece385/lab4/lab3.srcs/constrs_1/imports/pin_assignment/top.xdc:1]
Resolution: If [get_<value>] was used to populate the object, check to make sure this command returns at least one valid object.
WARNING: [Vivado 12-584] No ports matched 'sw_i[14]'. [/home/ece385user/Documents/ece385/lab4/lab3.srcs/constrs_1/imports/pin_assignment/top.xdc:2]
CRITICAL WARNING: [Common 17-55] 'set_property' expects at least one object. [/home/ece385user/Documents/ece385/lab4/lab3.srcs/constrs_1/imports/pin_assignment/top.xdc:2]
Resolution: If [get_<value>] was used to populate the object, check to make sure this command returns at least one valid object.
WARNING: [Vivado 12-584] No ports matched 'sw_i[13]'. [/home/ece385user/Documents/ece385/lab4/lab3.srcs/constrs_1/imports/pin_assignment/top.xdc:3]
CRITICAL WARNING: [Common 17-55] 'set_property' expects at least one object. [/home/ece385user/Documents/ece385/lab4/lab3.srcs/constrs_1/imports/pin_assignment/top.xdc:3]
Resolution: If [get_<value>] was used to populate the object, check to make sure this command returns at least one valid object.
WARNING: [Vivado 12-584] No ports matched 'sw_i[12]'. [/home/ece385user/Documents/ece385/lab4/lab3.srcs/constrs_1/imports/pin_assignment/top.xdc:4]
CRITICAL WARNING: [Common 17-55] 'set_property' expects at least one object. [/home/ece385user/Documents/ece385/lab4/lab3.srcs/constrs_1/imports/pin_assignment/top.xdc:4]
Resolution: If [get_<value>] was used to populate the object, check to make sure this command returns at least one valid object.
WARNING: [Vivado 12-584] No ports matched 'sw_i[11]'. [/home/ece385user/Documents/ece385/lab4/lab3.srcs/constrs_1/imports/pin_assignment/top.xdc:5]
CRITICAL WARNING: [Common 17-55] 'set_property' expects at least one object. [/home/ece385user/Documents/ece385/lab4/lab3.srcs/constrs_1/imports/pin_assignment/top.xdc:5]
Resolution: If [get_<value>] was used to populate the object, check to make sure this command returns at least one valid object.
WARNING: [Vivado 12-584] No ports matched 'sw_i[10]'. [/home/ece385user/Documents/ece385/lab4/lab3.srcs/constrs_1/imports/pin_assignment/top.xdc:6]
CRITICAL WARNING: [Common 17-55] 'set_property' expects at least one object. [/home/ece385user/Documents/ece385/lab4/lab3.srcs/constrs_1/imports/pin_assignment/top.xdc:6]
Resolution: If [get_<value>] was used to populate the object, check to make sure this command returns at least one valid object.
WARNING: [Vivado 12-584] No ports matched 'sw_i[9]'. [/home/ece385user/Documents/ece385/lab4/lab3.srcs/constrs_1/imports/pin_assignment/top.xdc:7]
CRITICAL WARNING: [Common 17-55] 'set_property' expects at least one object. [/home/ece385user/Documents/ece385/lab4/lab3.srcs/constrs_1/imports/pin_assignment/top.xdc:7]
Resolution: If [get_<value>] was used to populate the object, check to make sure this command returns at least one valid object.
WARNING: [Vivado 12-584] No ports matched 'sw_i[8]'. [/home/ece385user/Documents/ece385/lab4/lab3.srcs/constrs_1/imports/pin_assignment/top.xdc:8]
CRITICAL WARNING: [Common 17-55] 'set_property' expects at least one object. [/home/ece385user/Documents/ece385/lab4/lab3.srcs/constrs_1/imports/pin_assignment/top.xdc:8]
Resolution: If [get_<value>] was used to populate the object, check to make sure this command returns at least one valid object.
WARNING: [Vivado 12-584] No ports matched 'sw_i[8]'. [/home/ece385user/Documents/ece385/lab4/lab3.srcs/constrs_1/imports/pin_assignment/top.xdc:26]
CRITICAL WARNING: [Common 17-55] 'set_property' expects at least one object. [/home/ece385user/Documents/ece385/lab4/lab3.srcs/constrs_1/imports/pin_assignment/top.xdc:26]
Resolution: If [get_<value>] was used to populate the object, check to make sure this command returns at least one valid object.
WARNING: [Vivado 12-584] No ports matched 'sw_i[9]'. [/home/ece385user/Documents/ece385/lab4/lab3.srcs/constrs_1/imports/pin_assignment/top.xdc:27]
CRITICAL WARNING: [Common 17-55] 'set_property' expects at least one object. [/home/ece385user/Documents/ece385/lab4/lab3.srcs/constrs_1/imports/pin_assignment/top.xdc:27]
Resolution: If [get_<value>] was used to populate the object, check to make sure this command returns at least one valid object.
WARNING: [Vivado 12-584] No ports matched 'run_i'. [/home/ece385user/Documents/ece385/lab4/lab3.srcs/constrs_1/imports/pin_assignment/top.xdc:28]
CRITICAL WARNING: [Common 17-55] 'set_property' expects at least one object. [/home/ece385user/Documents/ece385/lab4/lab3.srcs/constrs_1/imports/pin_assignment/top.xdc:28]
Resolution: If [get_<value>] was used to populate the object, check to make sure this command returns at least one valid object.
WARNING: [Vivado 12-584] No ports matched 'reset'. [/home/ece385user/Documents/ece385/lab4/lab3.srcs/constrs_1/imports/pin_assignment/top.xdc:29]
CRITICAL WARNING: [Common 17-55] 'set_property' expects at least one object. [/home/ece385user/Documents/ece385/lab4/lab3.srcs/constrs_1/imports/pin_assignment/top.xdc:29]
Resolution: If [get_<value>] was used to populate the object, check to make sure this command returns at least one valid object.
WARNING: [Vivado 12-584] No ports matched 'reset'. [/home/ece385user/Documents/ece385/lab4/lab3.srcs/constrs_1/imports/pin_assignment/top.xdc:32]
CRITICAL WARNING: [Common 17-55] 'set_property' expects at least one object. [/home/ece385user/Documents/ece385/lab4/lab3.srcs/constrs_1/imports/pin_assignment/top.xdc:32]
Resolution: If [get_<value>] was used to populate the object, check to make sure this command returns at least one valid object.
WARNING: [Vivado 12-584] No ports matched 'run_i'. [/home/ece385user/Documents/ece385/lab4/lab3.srcs/constrs_1/imports/pin_assignment/top.xdc:33]
CRITICAL WARNING: [Common 17-55] 'set_property' expects at least one object. [/home/ece385user/Documents/ece385/lab4/lab3.srcs/constrs_1/imports/pin_assignment/top.xdc:33]
Resolution: If [get_<value>] was used to populate the object, check to make sure this command returns at least one valid object.
WARNING: [Vivado 12-584] No ports matched 'sign_led'. [/home/ece385user/Documents/ece385/lab4/lab3.srcs/constrs_1/imports/pin_assignment/top.xdc:40]
CRITICAL WARNING: [Common 17-55] 'set_property' expects at least one object. [/home/ece385user/Documents/ece385/lab4/lab3.srcs/constrs_1/imports/pin_assignment/top.xdc:40]
Resolution: If [get_<value>] was used to populate the object, check to make sure this command returns at least one valid object.
WARNING: [Vivado 12-584] No ports matched 'sign_led'. [/home/ece385user/Documents/ece385/lab4/lab3.srcs/constrs_1/imports/pin_assignment/top.xdc:41]
CRITICAL WARNING: [Common 17-55] 'set_property' expects at least one object. [/home/ece385user/Documents/ece385/lab4/lab3.srcs/constrs_1/imports/pin_assignment/top.xdc:41]
Resolution: If [get_<value>] was used to populate the object, check to make sure this command returns at least one valid object.
WARNING: [Vivado 12-584] No ports matched 'hex_grid_a[3]'. [/home/ece385user/Documents/ece385/lab4/lab3.srcs/constrs_1/imports/pin_assignment/top.xdc:42]
CRITICAL WARNING: [Common 17-55] 'set_property' expects at least one object. [/home/ece385user/Documents/ece385/lab4/lab3.srcs/constrs_1/imports/pin_assignment/top.xdc:42]
Resolution: If [get_<value>] was used to populate the object, check to make sure this command returns at least one valid object.
WARNING: [Vivado 12-584] No ports matched 'hex_grid_a[2]'. [/home/ece385user/Documents/ece385/lab4/lab3.srcs/constrs_1/imports/pin_assignment/top.xdc:43]
CRITICAL WARNING: [Common 17-55] 'set_property' expects at least one object. [/home/ece385user/Documents/ece385/lab4/lab3.srcs/constrs_1/imports/pin_assignment/top.xdc:43]
Resolution: If [get_<value>] was used to populate the object, check to make sure this command returns at least one valid object.
WARNING: [Vivado 12-584] No ports matched 'hex_grid_a[1]'. [/home/ece385user/Documents/ece385/lab4/lab3.srcs/constrs_1/imports/pin_assignment/top.xdc:44]
CRITICAL WARNING: [Common 17-55] 'set_property' expects at least one object. [/home/ece385user/Documents/ece385/lab4/lab3.srcs/constrs_1/imports/pin_assignment/top.xdc:44]
Resolution: If [get_<value>] was used to populate the object, check to make sure this command returns at least one valid object.
WARNING: [Vivado 12-584] No ports matched 'hex_grid_a[0]'. [/home/ece385user/Documents/ece385/lab4/lab3.srcs/constrs_1/imports/pin_assignment/top.xdc:45]
CRITICAL WARNING: [Common 17-55] 'set_property' expects at least one object. [/home/ece385user/Documents/ece385/lab4/lab3.srcs/constrs_1/imports/pin_assignment/top.xdc:45]
Resolution: If [get_<value>] was used to populate the object, check to make sure this command returns at least one valid object.
WARNING: [Vivado 12-584] No ports matched 'hex_grid_b[3]'. [/home/ece385user/Documents/ece385/lab4/lab3.srcs/constrs_1/imports/pin_assignment/top.xdc:46]
CRITICAL WARNING: [Common 17-55] 'set_property' expects at least one object. [/home/ece385user/Documents/ece385/lab4/lab3.srcs/constrs_1/imports/pin_assignment/top.xdc:46]
Resolution: If [get_<value>] was used to populate the object, check to make sure this command returns at least one valid object.
WARNING: [Vivado 12-584] No ports matched 'hex_grid_b[2]'. [/home/ece385user/Documents/ece385/lab4/lab3.srcs/constrs_1/imports/pin_assignment/top.xdc:47]
CRITICAL WARNING: [Common 17-55] 'set_property' expects at least one object. [/home/ece385user/Documents/ece385/lab4/lab3.srcs/constrs_1/imports/pin_assignment/top.xdc:47]
Resolution: If [get_<value>] was used to populate the object, check to make sure this command returns at least one valid object.
WARNING: [Vivado 12-584] No ports matched 'hex_grid_b[1]'. [/home/ece385user/Documents/ece385/lab4/lab3.srcs/constrs_1/imports/pin_assignment/top.xdc:48]
CRITICAL WARNING: [Common 17-55] 'set_property' expects at least one object. [/home/ece385user/Documents/ece385/lab4/lab3.srcs/constrs_1/imports/pin_assignment/top.xdc:48]
Resolution: If [get_<value>] was used to populate the object, check to make sure this command returns at least one valid object.
WARNING: [Vivado 12-584] No ports matched 'hex_grid_b[0]'. [/home/ece385user/Documents/ece385/lab4/lab3.srcs/constrs_1/imports/pin_assignment/top.xdc:49]
CRITICAL WARNING: [Common 17-55] 'set_property' expects at least one object. [/home/ece385user/Documents/ece385/lab4/lab3.srcs/constrs_1/imports/pin_assignment/top.xdc:49]
Resolution: If [get_<value>] was used to populate the object, check to make sure this command returns at least one valid object.
WARNING: [Vivado 12-584] No ports matched 'hex_seg_a[7]'. [/home/ece385user/Documents/ece385/lab4/lab3.srcs/constrs_1/imports/pin_assignment/top.xdc:50]
CRITICAL WARNING: [Common 17-55] 'set_property' expects at least one object. [/home/ece385user/Documents/ece385/lab4/lab3.srcs/constrs_1/imports/pin_assignment/top.xdc:50]
Resolution: If [get_<value>] was used to populate the object, check to make sure this command returns at least one valid object.
WARNING: [Vivado 12-584] No ports matched 'hex_seg_a[6]'. [/home/ece385user/Documents/ece385/lab4/lab3.srcs/constrs_1/imports/pin_assignment/top.xdc:51]
CRITICAL WARNING: [Common 17-55] 'set_property' expects at least one object. [/home/ece385user/Documents/ece385/lab4/lab3.srcs/constrs_1/imports/pin_assignment/top.xdc:51]
Resolution: If [get_<value>] was used to populate the object, check to make sure this command returns at least one valid object.
WARNING: [Vivado 12-584] No ports matched 'hex_seg_a[5]'. [/home/ece385user/Documents/ece385/lab4/lab3.srcs/constrs_1/imports/pin_assignment/top.xdc:52]
CRITICAL WARNING: [Common 17-55] 'set_property' expects at least one object. [/home/ece385user/Documents/ece385/lab4/lab3.srcs/constrs_1/imports/pin_assignment/top.xdc:52]
Resolution: If [get_<value>] was used to populate the object, check to make sure this command returns at least one valid object.
WARNING: [Vivado 12-584] No ports matched 'hex_seg_a[4]'. [/home/ece385user/Documents/ece385/lab4/lab3.srcs/constrs_1/imports/pin_assignment/top.xdc:53]
CRITICAL WARNING: [Common 17-55] 'set_property' expects at least one object. [/home/ece385user/Documents/ece385/lab4/lab3.srcs/constrs_1/imports/pin_assignment/top.xdc:53]
Resolution: If [get_<value>] was used to populate the object, check to make sure this command returns at least one valid object.
WARNING: [Vivado 12-584] No ports matched 'hex_seg_a[3]'. [/home/ece385user/Documents/ece385/lab4/lab3.srcs/constrs_1/imports/pin_assignment/top.xdc:54]
CRITICAL WARNING: [Common 17-55] 'set_property' expects at least one object. [/home/ece385user/Documents/ece385/lab4/lab3.srcs/constrs_1/imports/pin_assignment/top.xdc:54]
Resolution: If [get_<value>] was used to populate the object, check to make sure this command returns at least one valid object.
WARNING: [Vivado 12-584] No ports matched 'hex_seg_a[2]'. [/home/ece385user/Documents/ece385/lab4/lab3.srcs/constrs_1/imports/pin_assignment/top.xdc:55]
CRITICAL WARNING: [Common 17-55] 'set_property' expects at least one object. [/home/ece385user/Documents/ece385/lab4/lab3.srcs/constrs_1/imports/pin_assignment/top.xdc:55]
Resolution: If [get_<value>] was used to populate the object, check to make sure this command returns at least one valid object.
WARNING: [Vivado 12-584] No ports matched 'hex_seg_a[1]'. [/home/ece385user/Documents/ece385/lab4/lab3.srcs/constrs_1/imports/pin_assignment/top.xdc:56]
CRITICAL WARNING: [Common 17-55] 'set_property' expects at least one object. [/home/ece385user/Documents/ece385/lab4/lab3.srcs/constrs_1/imports/pin_assignment/top.xdc:56]
Resolution: If [get_<value>] was used to populate the object, check to make sure this command returns at least one valid object.
WARNING: [Vivado 12-584] No ports matched 'hex_seg_a[0]'. [/home/ece385user/Documents/ece385/lab4/lab3.srcs/constrs_1/imports/pin_assignment/top.xdc:57]
CRITICAL WARNING: [Common 17-55] 'set_property' expects at least one object. [/home/ece385user/Documents/ece385/lab4/lab3.srcs/constrs_1/imports/pin_assignment/top.xdc:57]
Resolution: If [get_<value>] was used to populate the object, check to make sure this command returns at least one valid object.
WARNING: [Vivado 12-584] No ports matched 'hex_seg_b[7]'. [/home/ece385user/Documents/ece385/lab4/lab3.srcs/constrs_1/imports/pin_assignment/top.xdc:58]
CRITICAL WARNING: [Common 17-55] 'set_property' expects at least one object. [/home/ece385user/Documents/ece385/lab4/lab3.srcs/constrs_1/imports/pin_assignment/top.xdc:58]
Resolution: If [get_<value>] was used to populate the object, check to make sure this command returns at least one valid object.
WARNING: [Vivado 12-584] No ports matched 'hex_seg_b[6]'. [/home/ece385user/Documents/ece385/lab4/lab3.srcs/constrs_1/imports/pin_assignment/top.xdc:59]
CRITICAL WARNING: [Common 17-55] 'set_property' expects at least one object. [/home/ece385user/Documents/ece385/lab4/lab3.srcs/constrs_1/imports/pin_assignment/top.xdc:59]
Resolution: If [get_<value>] was used to populate the object, check to make sure this command returns at least one valid object.
WARNING: [Vivado 12-584] No ports matched 'hex_seg_b[5]'. [/home/ece385user/Documents/ece385/lab4/lab3.srcs/constrs_1/imports/pin_assignment/top.xdc:60]
CRITICAL WARNING: [Common 17-55] 'set_property' expects at least one object. [/home/ece385user/Documents/ece385/lab4/lab3.srcs/constrs_1/imports/pin_assignment/top.xdc:60]
Resolution: If [get_<value>] was used to populate the object, check to make sure this command returns at least one valid object.
WARNING: [Vivado 12-584] No ports matched 'hex_seg_b[4]'. [/home/ece385user/Documents/ece385/lab4/lab3.srcs/constrs_1/imports/pin_assignment/top.xdc:61]
CRITICAL WARNING: [Common 17-55] 'set_property' expects at least one object. [/home/ece385user/Documents/ece385/lab4/lab3.srcs/constrs_1/imports/pin_assignment/top.xdc:61]
Resolution: If [get_<value>] was used to populate the object, check to make sure this command returns at least one valid object.
WARNING: [Vivado 12-584] No ports matched 'hex_seg_b[3]'. [/home/ece385user/Documents/ece385/lab4/lab3.srcs/constrs_1/imports/pin_assignment/top.xdc:62]
CRITICAL WARNING: [Common 17-55] 'set_property' expects at least one object. [/home/ece385user/Documents/ece385/lab4/lab3.srcs/constrs_1/imports/pin_assignment/top.xdc:62]
Resolution: If [get_<value>] was used to populate the object, check to make sure this command returns at least one valid object.
WARNING: [Vivado 12-584] No ports matched 'hex_seg_b[2]'. [/home/ece385user/Documents/ece385/lab4/lab3.srcs/constrs_1/imports/pin_assignment/top.xdc:63]
CRITICAL WARNING: [Common 17-55] 'set_property' expects at least one object. [/home/ece385user/Documents/ece385/lab4/lab3.srcs/constrs_1/imports/pin_assignment/top.xdc:63]
Resolution: If [get_<value>] was used to populate the object, check to make sure this command returns at least one valid object.
WARNING: [Vivado 12-584] No ports matched 'hex_seg_b[1]'. [/home/ece385user/Documents/ece385/lab4/lab3.srcs/constrs_1/imports/pin_assignment/top.xdc:64]
CRITICAL WARNING: [Common 17-55] 'set_property' expects at least one object. [/home/ece385user/Documents/ece385/lab4/lab3.srcs/constrs_1/imports/pin_assignment/top.xdc:64]
Resolution: If [get_<value>] was used to populate the object, check to make sure this command returns at least one valid object.
WARNING: [Vivado 12-584] No ports matched 'hex_seg_b[0]'. [/home/ece385user/Documents/ece385/lab4/lab3.srcs/constrs_1/imports/pin_assignment/top.xdc:65]
CRITICAL WARNING: [Common 17-55] 'set_property' expects at least one object. [/home/ece385user/Documents/ece385/lab4/lab3.srcs/constrs_1/imports/pin_assignment/top.xdc:65]
Resolution: If [get_<value>] was used to populate the object, check to make sure this command returns at least one valid object.
WARNING: [Vivado 12-584] No ports matched 'hex_grid_a[0]'. [/home/ece385user/Documents/ece385/lab4/lab3.srcs/constrs_1/imports/pin_assignment/top.xdc:66]
CRITICAL WARNING: [Common 17-55] 'set_property' expects at least one object. [/home/ece385user/Documents/ece385/lab4/lab3.srcs/constrs_1/imports/pin_assignment/top.xdc:66]
Resolution: If [get_<value>] was used to populate the object, check to make sure this command returns at least one valid object.
WARNING: [Vivado 12-584] No ports matched 'hex_grid_a[1]'. [/home/ece385user/Documents/ece385/lab4/lab3.srcs/constrs_1/imports/pin_assignment/top.xdc:67]
CRITICAL WARNING: [Common 17-55] 'set_property' expects at least one object. [/home/ece385user/Documents/ece385/lab4/lab3.srcs/constrs_1/imports/pin_assignment/top.xdc:67]
Resolution: If [get_<value>] was used to populate the object, check to make sure this command returns at least one valid object.
WARNING: [Vivado 12-584] No ports matched 'hex_grid_a[2]'. [/home/ece385user/Documents/ece385/lab4/lab3.srcs/constrs_1/imports/pin_assignment/top.xdc:68]
CRITICAL WARNING: [Common 17-55] 'set_property' expects at least one object. [/home/ece385user/Documents/ece385/lab4/lab3.srcs/constrs_1/imports/pin_assignment/top.xdc:68]
Resolution: If [get_<value>] was used to populate the object, check to make sure this command returns at least one valid object.
WARNING: [Vivado 12-584] No ports matched 'hex_grid_a[3]'. [/home/ece385user/Documents/ece385/lab4/lab3.srcs/constrs_1/imports/pin_assignment/top.xdc:69]
CRITICAL WARNING: [Common 17-55] 'set_property' expects at least one object. [/home/ece385user/Documents/ece385/lab4/lab3.srcs/constrs_1/imports/pin_assignment/top.xdc:69]
Resolution: If [get_<value>] was used to populate the object, check to make sure this command returns at least one valid object.
WARNING: [Vivado 12-584] No ports matched 'hex_seg_a[0]'. [/home/ece385user/Documents/ece385/lab4/lab3.srcs/constrs_1/imports/pin_assignment/top.xdc:70]
CRITICAL WARNING: [Common 17-55] 'set_property' expects at least one object. [/home/ece385user/Documents/ece385/lab4/lab3.srcs/constrs_1/imports/pin_assignment/top.xdc:70]
Resolution: If [get_<value>] was used to populate the object, check to make sure this command returns at least one valid object.
WARNING: [Vivado 12-584] No ports matched 'hex_seg_a[1]'. [/home/ece385user/Documents/ece385/lab4/lab3.srcs/constrs_1/imports/pin_assignment/top.xdc:71]
CRITICAL WARNING: [Common 17-55] 'set_property' expects at least one object. [/home/ece385user/Documents/ece385/lab4/lab3.srcs/constrs_1/imports/pin_assignment/top.xdc:71]
Resolution: If [get_<value>] was used to populate the object, check to make sure this command returns at least one valid object.
WARNING: [Vivado 12-584] No ports matched 'hex_seg_a[2]'. [/home/ece385user/Documents/ece385/lab4/lab3.srcs/constrs_1/imports/pin_assignment/top.xdc:72]
CRITICAL WARNING: [Common 17-55] 'set_property' expects at least one object. [/home/ece385user/Documents/ece385/lab4/lab3.srcs/constrs_1/imports/pin_assignment/top.xdc:72]
Resolution: If [get_<value>] was used to populate the object, check to make sure this command returns at least one valid object.
WARNING: [Vivado 12-584] No ports matched 'hex_seg_a[3]'. [/home/ece385user/Documents/ece385/lab4/lab3.srcs/constrs_1/imports/pin_assignment/top.xdc:73]
CRITICAL WARNING: [Common 17-55] 'set_property' expects at least one object. [/home/ece385user/Documents/ece385/lab4/lab3.srcs/constrs_1/imports/pin_assignment/top.xdc:73]
Resolution: If [get_<value>] was used to populate the object, check to make sure this command returns at least one valid object.
WARNING: [Vivado 12-584] No ports matched 'hex_seg_a[4]'. [/home/ece385user/Documents/ece385/lab4/lab3.srcs/constrs_1/imports/pin_assignment/top.xdc:74]
CRITICAL WARNING: [Common 17-55] 'set_property' expects at least one object. [/home/ece385user/Documents/ece385/lab4/lab3.srcs/constrs_1/imports/pin_assignment/top.xdc:74]
Resolution: If [get_<value>] was used to populate the object, check to make sure this command returns at least one valid object.
WARNING: [Vivado 12-584] No ports matched 'hex_seg_a[5]'. [/home/ece385user/Documents/ece385/lab4/lab3.srcs/constrs_1/imports/pin_assignment/top.xdc:75]
CRITICAL WARNING: [Common 17-55] 'set_property' expects at least one object. [/home/ece385user/Documents/ece385/lab4/lab3.srcs/constrs_1/imports/pin_assignment/top.xdc:75]
Resolution: If [get_<value>] was used to populate the object, check to make sure this command returns at least one valid object.
WARNING: [Vivado 12-584] No ports matched 'hex_seg_a[6]'. [/home/ece385user/Documents/ece385/lab4/lab3.srcs/constrs_1/imports/pin_assignment/top.xdc:76]
CRITICAL WARNING: [Common 17-55] 'set_property' expects at least one object. [/home/ece385user/Documents/ece385/lab4/lab3.srcs/constrs_1/imports/pin_assignment/top.xdc:76]
Resolution: If [get_<value>] was used to populate the object, check to make sure this command returns at least one valid object.
WARNING: [Vivado 12-584] No ports matched 'hex_seg_a[7]'. [/home/ece385user/Documents/ece385/lab4/lab3.srcs/constrs_1/imports/pin_assignment/top.xdc:77]
CRITICAL WARNING: [Common 17-55] 'set_property' expects at least one object. [/home/ece385user/Documents/ece385/lab4/lab3.srcs/constrs_1/imports/pin_assignment/top.xdc:77]
Resolution: If [get_<value>] was used to populate the object, check to make sure this command returns at least one valid object.
WARNING: [Vivado 12-584] No ports matched 'hex_seg_b[0]'. [/home/ece385user/Documents/ece385/lab4/lab3.srcs/constrs_1/imports/pin_assignment/top.xdc:78]
CRITICAL WARNING: [Common 17-55] 'set_property' expects at least one object. [/home/ece385user/Documents/ece385/lab4/lab3.srcs/constrs_1/imports/pin_assignment/top.xdc:78]
Resolution: If [get_<value>] was used to populate the object, check to make sure this command returns at least one valid object.
WARNING: [Vivado 12-584] No ports matched 'hex_seg_b[1]'. [/home/ece385user/Documents/ece385/lab4/lab3.srcs/constrs_1/imports/pin_assignment/top.xdc:79]
CRITICAL WARNING: [Common 17-55] 'set_property' expects at least one object. [/home/ece385user/Documents/ece385/lab4/lab3.srcs/constrs_1/imports/pin_assignment/top.xdc:79]
Resolution: If [get_<value>] was used to populate the object, check to make sure this command returns at least one valid object.
WARNING: [Vivado 12-584] No ports matched 'hex_seg_b[2]'. [/home/ece385user/Documents/ece385/lab4/lab3.srcs/constrs_1/imports/pin_assignment/top.xdc:80]
CRITICAL WARNING: [Common 17-55] 'set_property' expects at least one object. [/home/ece385user/Documents/ece385/lab4/lab3.srcs/constrs_1/imports/pin_assignment/top.xdc:80]
Resolution: If [get_<value>] was used to populate the object, check to make sure this command returns at least one valid object.
WARNING: [Vivado 12-584] No ports matched 'hex_seg_b[3]'. [/home/ece385user/Documents/ece385/lab4/lab3.srcs/constrs_1/imports/pin_assignment/top.xdc:81]
CRITICAL WARNING: [Common 17-55] 'set_property' expects at least one object. [/home/ece385user/Documents/ece385/lab4/lab3.srcs/constrs_1/imports/pin_assignment/top.xdc:81]
Resolution: If [get_<value>] was used to populate the object, check to make sure this command returns at least one valid object.
WARNING: [Vivado 12-584] No ports matched 'hex_seg_b[4]'. [/home/ece385user/Documents/ece385/lab4/lab3.srcs/constrs_1/imports/pin_assignment/top.xdc:82]
CRITICAL WARNING: [Common 17-55] 'set_property' expects at least one object. [/home/ece385user/Documents/ece385/lab4/lab3.srcs/constrs_1/imports/pin_assignment/top.xdc:82]
Resolution: If [get_<value>] was used to populate the object, check to make sure this command returns at least one valid object.
WARNING: [Vivado 12-584] No ports matched 'hex_seg_b[5]'. [/home/ece385user/Documents/ece385/lab4/lab3.srcs/constrs_1/imports/pin_assignment/top.xdc:83]
CRITICAL WARNING: [Common 17-55] 'set_property' expects at least one object. [/home/ece385user/Documents/ece385/lab4/lab3.srcs/constrs_1/imports/pin_assignment/top.xdc:83]
Resolution: If [get_<value>] was used to populate the object, check to make sure this command returns at least one valid object.
WARNING: [Vivado 12-584] No ports matched 'hex_seg_b[6]'. [/home/ece385user/Documents/ece385/lab4/lab3.srcs/constrs_1/imports/pin_assignment/top.xdc:84]
CRITICAL WARNING: [Common 17-55] 'set_property' expects at least one object. [/home/ece385user/Documents/ece385/lab4/lab3.srcs/constrs_1/imports/pin_assignment/top.xdc:84]
Resolution: If [get_<value>] was used to populate the object, check to make sure this command returns at least one valid object.
WARNING: [Vivado 12-584] No ports matched 'hex_seg_b[7]'. [/home/ece385user/Documents/ece385/lab4/lab3.srcs/constrs_1/imports/pin_assignment/top.xdc:85]
CRITICAL WARNING: [Common 17-55] 'set_property' expects at least one object. [/home/ece385user/Documents/ece385/lab4/lab3.srcs/constrs_1/imports/pin_assignment/top.xdc:85]
Resolution: If [get_<value>] was used to populate the object, check to make sure this command returns at least one valid object.
WARNING: [Vivado 12-584] No ports matched 'hex_grid_b[0]'. [/home/ece385user/Documents/ece385/lab4/lab3.srcs/constrs_1/imports/pin_assignment/top.xdc:86]
CRITICAL WARNING: [Common 17-55] 'set_property' expects at least one object. [/home/ece385user/Documents/ece385/lab4/lab3.srcs/constrs_1/imports/pin_assignment/top.xdc:86]
Resolution: If [get_<value>] was used to populate the object, check to make sure this command returns at least one valid object.
WARNING: [Vivado 12-584] No ports matched 'hex_grid_b[1]'. [/home/ece385user/Documents/ece385/lab4/lab3.srcs/constrs_1/imports/pin_assignment/top.xdc:87]
CRITICAL WARNING: [Common 17-55] 'set_property' expects at least one object. [/home/ece385user/Documents/ece385/lab4/lab3.srcs/constrs_1/imports/pin_assignment/top.xdc:87]
Resolution: If [get_<value>] was used to populate the object, check to make sure this command returns at least one valid object.
WARNING: [Vivado 12-584] No ports matched 'hex_grid_b[2]'. [/home/ece385user/Documents/ece385/lab4/lab3.srcs/constrs_1/imports/pin_assignment/top.xdc:88]
CRITICAL WARNING: [Common 17-55] 'set_property' expects at least one object. [/home/ece385user/Documents/ece385/lab4/lab3.srcs/constrs_1/imports/pin_assignment/top.xdc:88]
Resolution: If [get_<value>] was used to populate the object, check to make sure this command returns at least one valid object.
WARNING: [Vivado 12-584] No ports matched 'hex_grid_b[3]'. [/home/ece385user/Documents/ece385/lab4/lab3.srcs/constrs_1/imports/pin_assignment/top.xdc:89]
CRITICAL WARNING: [Common 17-55] 'set_property' expects at least one object. [/home/ece385user/Documents/ece385/lab4/lab3.srcs/constrs_1/imports/pin_assignment/top.xdc:89]
Resolution: If [get_<value>] was used to populate the object, check to make sure this command returns at least one valid object.
WARNING: [Vivado 12-584] No ports matched 'sw_i[10]'. [/home/ece385user/Documents/ece385/lab4/lab3.srcs/constrs_1/imports/pin_assignment/top.xdc:90]
CRITICAL WARNING: [Common 17-55] 'set_property' expects at least one object. [/home/ece385user/Documents/ece385/lab4/lab3.srcs/constrs_1/imports/pin_assignment/top.xdc:90]
Resolution: If [get_<value>] was used to populate the object, check to make sure this command returns at least one valid object.
WARNING: [Vivado 12-584] No ports matched 'sw_i[11]'. [/home/ece385user/Documents/ece385/lab4/lab3.srcs/constrs_1/imports/pin_assignment/top.xdc:91]
CRITICAL WARNING: [Common 17-55] 'set_property' expects at least one object. [/home/ece385user/Documents/ece385/lab4/lab3.srcs/constrs_1/imports/pin_assignment/top.xdc:91]
Resolution: If [get_<value>] was used to populate the object, check to make sure this command returns at least one valid object.
WARNING: [Vivado 12-584] No ports matched 'sw_i[12]'. [/home/ece385user/Documents/ece385/lab4/lab3.srcs/constrs_1/imports/pin_assignment/top.xdc:92]
CRITICAL WARNING: [Common 17-55] 'set_property' expects at least one object. [/home/ece385user/Documents/ece385/lab4/lab3.srcs/constrs_1/imports/pin_assignment/top.xdc:92]
Resolution: If [get_<value>] was used to populate the object, check to make sure this command returns at least one valid object.
WARNING: [Vivado 12-584] No ports matched 'sw_i[13]'. [/home/ece385user/Documents/ece385/lab4/lab3.srcs/constrs_1/imports/pin_assignment/top.xdc:93]
CRITICAL WARNING: [Common 17-55] 'set_property' expects at least one object. [/home/ece385user/Documents/ece385/lab4/lab3.srcs/constrs_1/imports/pin_assignment/top.xdc:93]
Resolution: If [get_<value>] was used to populate the object, check to make sure this command returns at least one valid object.
WARNING: [Vivado 12-584] No ports matched 'sw_i[14]'. [/home/ece385user/Documents/ece385/lab4/lab3.srcs/constrs_1/imports/pin_assignment/top.xdc:94]
CRITICAL WARNING: [Common 17-55] 'set_property' expects at least one object. [/home/ece385user/Documents/ece385/lab4/lab3.srcs/constrs_1/imports/pin_assignment/top.xdc:94]
Resolution: If [get_<value>] was used to populate the object, check to make sure this command returns at least one valid object.
WARNING: [Vivado 12-584] No ports matched 'sw_i[15]'. [/home/ece385user/Documents/ece385/lab4/lab3.srcs/constrs_1/imports/pin_assignment/top.xdc:95]
CRITICAL WARNING: [Common 17-55] 'set_property' expects at least one object. [/home/ece385user/Documents/ece385/lab4/lab3.srcs/constrs_1/imports/pin_assignment/top.xdc:95]
Resolution: If [get_<value>] was used to populate the object, check to make sure this command returns at least one valid object.
WARNING: [Vivado 12-507] No nets matched 'counter/curr_state__0[3]'. [/home/ece385user/Documents/ece385/lab4/lab3.srcs/constrs_1/imports/pin_assignment/top.xdc:185]
CRITICAL WARNING: [Common 17-55] 'set_property' expects at least one object. [/home/ece385user/Documents/ece385/lab4/lab3.srcs/constrs_1/imports/pin_assignment/top.xdc:185]
Resolution: If [get_<value>] was used to populate the object, check to make sure this command returns at least one valid object.
Finished Parsing XDC File [/home/ece385user/Documents/ece385/lab4/lab3.srcs/constrs_1/imports/pin_assignment/top.xdc]
INFO: [Opt 31-138] Pushed 0 inverter(s) to 0 load pin(s).
Netlist sorting complete. Time (s): cpu = 00:00:00 ; elapsed = 00:00:00 . Memory (MB): peak = 1818.871 ; gain = 0.000 ; free physical = 5375 ; free virtual = 10890
INFO: [Project 1-111] Unisim Transformation Summary:
No Unisim elements were transformed.

7 Infos, 71 Warnings, 71 Critical Warnings and 0 Errors encountered.
link_design completed successfully
INFO: [Common 17-600] The following parameters have non-default value.
tcl.collectionResultDisplayLimit
Command: opt_design
Attempting to get a license for feature 'Implementation' and/or device 'xc7s50'
INFO: [Common 17-349] Got license for feature 'Implementation' and/or device 'xc7s50'
Running DRC as a precondition to command opt_design

Starting DRC Task
INFO: [DRC 23-27] Running DRC with 8 threads
INFO: [Project 1-461] DRC finished with 0 Errors
INFO: [Project 1-462] Please refer to the DRC report (report_drc) for more information.

Time (s): cpu = 00:00:00.88 ; elapsed = 00:00:00.58 . Memory (MB): peak = 1896.777 ; gain = 71.969 ; free physical = 5367 ; free virtual = 10883

Starting Cache Timing Information Task
INFO: [Timing 38-35] Done setting XDC timing constraints.
Ending Cache Timing Information Task | Checksum: 14abcd10e

Time (s): cpu = 00:00:04 ; elapsed = 00:00:05 . Memory (MB): peak = 2289.441 ; gain = 392.664 ; free physical = 5072 ; free virtual = 10588

Starting Logic Optimization Task

Phase 1 Retarget
INFO: [Opt 31-138] Pushed 0 inverter(s) to 0 load pin(s).
INFO: [Opt 31-49] Retargeted 0 cell(s).
Phase 1 Retarget | Checksum: 14abcd10e

Time (s): cpu = 00:00:00.03 ; elapsed = 00:00:00.02 . Memory (MB): peak = 2569.332 ; gain = 0.000 ; free physical = 4824 ; free virtual = 10339
INFO: [Opt 31-389] Phase Retarget created 0 cells and removed 0 cells
INFO: [Opt 31-1021] In phase Retarget, 22 netlist objects are constrained preventing optimization. Please run opt_design with -debug_log to get more detail. 

Phase 2 Constant propagation
INFO: [Opt 31-138] Pushed 0 inverter(s) to 0 load pin(s).
Phase 2 Constant propagation | Checksum: 14abcd10e

Time (s): cpu = 00:00:00.03 ; elapsed = 00:00:00.02 . Memory (MB): peak = 2569.332 ; gain = 0.000 ; free physical = 4824 ; free virtual = 10339
INFO: [Opt 31-389] Phase Constant propagation created 0 cells and removed 0 cells
INFO: [Opt 31-1021] In phase Constant propagation, 1 netlist objects are constrained preventing optimization. Please run opt_design with -debug_log to get more detail. 

Phase 3 Sweep
Phase 3 Sweep | Checksum: 173011a4c

Time (s): cpu = 00:00:00.04 ; elapsed = 00:00:00.02 . Memory (MB): peak = 2569.332 ; gain = 0.000 ; free physical = 4824 ; free virtual = 10339
INFO: [Opt 31-389] Phase Sweep created 0 cells and removed 0 cells
INFO: [Opt 31-1021] In phase Sweep, 26 netlist objects are constrained preventing optimization. Please run opt_design with -debug_log to get more detail. 

Phase 4 BUFG optimization
Phase 4 BUFG optimization | Checksum: 173011a4c

Time (s): cpu = 00:00:00.05 ; elapsed = 00:00:00.03 . Memory (MB): peak = 2601.348 ; gain = 32.016 ; free physical = 4824 ; free virtual = 10339
INFO: [Opt 31-662] Phase BUFG optimization created 0 cells of which 0 are BUFGs and removed 0 cells.

Phase 5 Shift Register Optimization
INFO: [Opt 31-1064] SRL Remap converted 0 SRLs to 0 registers and converted 0 registers of register chains to 0 SRLs
Phase 5 Shift Register Optimization | Checksum: 173011a4c

Time (s): cpu = 00:00:00.05 ; elapsed = 00:00:00.03 . Memory (MB): peak = 2601.348 ; gain = 32.016 ; free physical = 4824 ; free virtual = 10339
INFO: [Opt 31-389] Phase Shift Register Optimization created 0 cells and removed 0 cells

Phase 6 Post Processing Netlist
Phase 6 Post Processing Netlist | Checksum: 173011a4c

Time (s): cpu = 00:00:00.05 ; elapsed = 00:00:00.03 . Memory (MB): peak = 2601.348 ; gain = 32.016 ; free physical = 4824 ; free virtual = 10339
INFO: [Opt 31-389] Phase Post Processing Netlist created 0 cells and removed 0 cells
Opt_design Change Summary
=========================


-------------------------------------------------------------------------------------------------------------------------
|  Phase                        |  #Cells created  |  #Cells Removed  |  #Constrained objects preventing optimizations  |
-------------------------------------------------------------------------------------------------------------------------
|  Retarget                     |               0  |               0  |                                             22  |
|  Constant propagation         |               0  |               0  |                                              1  |
|  Sweep                        |               0  |               0  |                                             26  |
|  BUFG optimization            |               0  |               0  |                                              0  |
|  Shift Register Optimization  |               0  |               0  |                                              0  |
|  Post Processing Netlist      |               0  |               0  |                                              0  |
-------------------------------------------------------------------------------------------------------------------------



Starting Connectivity Check Task

Time (s): cpu = 00:00:00 ; elapsed = 00:00:00 . Memory (MB): peak = 2601.348 ; gain = 0.000 ; free physical = 4824 ; free virtual = 10339
Ending Logic Optimization Task | Checksum: 19f7de5b2

Time (s): cpu = 00:00:00.07 ; elapsed = 00:00:00.05 . Memory (MB): peak = 2601.348 ; gain = 32.016 ; free physical = 4824 ; free virtual = 10339

Starting Power Optimization Task
INFO: [Pwropt 34-132] Skipping clock gating for clocks with a period < 2.00 ns.
Ending Power Optimization Task | Checksum: 19f7de5b2

Time (s): cpu = 00:00:00 ; elapsed = 00:00:00.01 . Memory (MB): peak = 2601.348 ; gain = 0.000 ; free physical = 4824 ; free virtual = 10339

Starting Final Cleanup Task
Ending Final Cleanup Task | Checksum: 19f7de5b2

Time (s): cpu = 00:00:00 ; elapsed = 00:00:00 . Memory (MB): peak = 2601.348 ; gain = 0.000 ; free physical = 4824 ; free virtual = 10339

Starting Netlist Obfuscation Task
Netlist sorting complete. Time (s): cpu = 00:00:00 ; elapsed = 00:00:00 . Memory (MB): peak = 2601.348 ; gain = 0.000 ; free physical = 4824 ; free virtual = 10339
Ending Netlist Obfuscation Task | Checksum: 19f7de5b2

Time (s): cpu = 00:00:00 ; elapsed = 00:00:00 . Memory (MB): peak = 2601.348 ; gain = 0.000 ; free physical = 4824 ; free virtual = 10339
INFO: [Common 17-83] Releasing license: Implementation
28 Infos, 71 Warnings, 71 Critical Warnings and 0 Errors encountered.
opt_design completed successfully
opt_design: Time (s): cpu = 00:00:07 ; elapsed = 00:00:07 . Memory (MB): peak = 2601.348 ; gain = 776.539 ; free physical = 4824 ; free virtual = 10339
INFO: [Timing 38-480] Writing timing data to binary archive.
Writing XDEF routing.
Writing XDEF routing logical nets.
Writing XDEF routing special nets.
Write XDEF Complete: Time (s): cpu = 00:00:00.05 ; elapsed = 00:00:00.02 . Memory (MB): peak = 2633.363 ; gain = 24.012 ; free physical = 4820 ; free virtual = 10337
INFO: [Common 17-1381] The checkpoint '/home/ece385user/Documents/ece385/lab4/lab3.runs/impl_1/multiplier_toplevel_opt.dcp' has been generated.
INFO: [runtcl-4] Executing : report_drc -file multiplier_toplevel_drc_opted.rpt -pb multiplier_toplevel_drc_opted.pb -rpx multiplier_toplevel_drc_opted.rpx
Command: report_drc -file multiplier_toplevel_drc_opted.rpt -pb multiplier_toplevel_drc_opted.pb -rpx multiplier_toplevel_drc_opted.rpx
INFO: [IP_Flow 19-234] Refreshing IP repositories
INFO: [IP_Flow 19-1704] No user IP repositories specified
INFO: [IP_Flow 19-2313] Loaded Vivado IP repository '/tools/Xilinx/Vivado/2022.2/data/ip'.
INFO: [DRC 23-27] Running DRC with 8 threads
INFO: [Vivado_Tcl 2-168] The results of DRC are in file /home/ece385user/Documents/ece385/lab4/lab3.runs/impl_1/multiplier_toplevel_drc_opted.rpt.
report_drc completed successfully
Command: place_design
Attempting to get a license for feature 'Implementation' and/or device 'xc7s50'
INFO: [Common 17-349] Got license for feature 'Implementation' and/or device 'xc7s50'
INFO: [DRC 23-27] Running DRC with 8 threads
INFO: [Vivado_Tcl 4-198] DRC finished with 0 Errors
INFO: [Vivado_Tcl 4-199] Please refer to the DRC report (report_drc) for more information.
Running DRC as a precondition to command place_design
INFO: [DRC 23-27] Running DRC with 8 threads
INFO: [Vivado_Tcl 4-198] DRC finished with 0 Errors
INFO: [Vivado_Tcl 4-199] Please refer to the DRC report (report_drc) for more information.

Starting Placer Task
INFO: [Place 30-611] Multithreading enabled for place_design using a maximum of 8 CPUs

Phase 1 Placer Initialization

Phase 1.1 Placer Initialization Netlist Sorting
Netlist sorting complete. Time (s): cpu = 00:00:00 ; elapsed = 00:00:00 . Memory (MB): peak = 2705.398 ; gain = 0.000 ; free physical = 4818 ; free virtual = 10334
Phase 1.1 Placer Initialization Netlist Sorting | Checksum: 119239ad8

Time (s): cpu = 00:00:00 ; elapsed = 00:00:00.01 . Memory (MB): peak = 2705.398 ; gain = 0.000 ; free physical = 4818 ; free virtual = 10334
Netlist sorting complete. Time (s): cpu = 00:00:00 ; elapsed = 00:00:00 . Memory (MB): peak = 2705.398 ; gain = 0.000 ; free physical = 4818 ; free virtual = 10334

Phase 1.2 IO Placement/ Clock Placement/ Build Placer Device
INFO: [Timing 38-35] Done setting XDC timing constraints.
Phase 1.2 IO Placement/ Clock Placement/ Build Placer Device | Checksum: 796c6c85

Time (s): cpu = 00:00:00.34 ; elapsed = 00:00:00.15 . Memory (MB): peak = 2705.398 ; gain = 0.000 ; free physical = 4794 ; free virtual = 10310

Phase 1.3 Build Placer Netlist Model
Phase 1.3 Build Placer Netlist Model | Checksum: 1648ba22d

Time (s): cpu = 00:00:00.53 ; elapsed = 00:00:00.23 . Memory (MB): peak = 2705.398 ; gain = 0.000 ; free physical = 4793 ; free virtual = 10309

Phase 1.4 Constrain Clocks/Macros
Phase 1.4 Constrain Clocks/Macros | Checksum: 1648ba22d

Time (s): cpu = 00:00:00.53 ; elapsed = 00:00:00.23 . Memory (MB): peak = 2705.398 ; gain = 0.000 ; free physical = 4793 ; free virtual = 10309
Phase 1 Placer Initialization | Checksum: 1648ba22d

Time (s): cpu = 00:00:00.54 ; elapsed = 00:00:00.24 . Memory (MB): peak = 2705.398 ; gain = 0.000 ; free physical = 4793 ; free virtual = 10309

Phase 2 Global Placement

Phase 2.1 Floorplanning
Phase 2.1 Floorplanning | Checksum: cf20c36f

Time (s): cpu = 00:00:00.78 ; elapsed = 00:00:00.29 . Memory (MB): peak = 2705.398 ; gain = 0.000 ; free physical = 4811 ; free virtual = 10327

Phase 2.2 Update Timing before SLR Path Opt
Phase 2.2 Update Timing before SLR Path Opt | Checksum: b1302e0d

Time (s): cpu = 00:00:00.83 ; elapsed = 00:00:00.31 . Memory (MB): peak = 2705.398 ; gain = 0.000 ; free physical = 4841 ; free virtual = 10357

Phase 2.3 Post-Processing in Floorplanning
Phase 2.3 Post-Processing in Floorplanning | Checksum: b1302e0d

Time (s): cpu = 00:00:00.84 ; elapsed = 00:00:00.31 . Memory (MB): peak = 2705.398 ; gain = 0.000 ; free physical = 4841 ; free virtual = 10357

Phase 2.4 Global Placement Core

Phase 2.4.1 UpdateTiming Before Physical Synthesis
Phase 2.4.1 UpdateTiming Before Physical Synthesis | Checksum: 11fca3274

Time (s): cpu = 00:00:03 ; elapsed = 00:00:00.76 . Memory (MB): peak = 2705.398 ; gain = 0.000 ; free physical = 4846 ; free virtual = 10362

Phase 2.4.2 Physical Synthesis In Placer
INFO: [Physopt 32-1035] Found 0 LUTNM shape to break, 13 LUT instances to create LUTNM shape
INFO: [Physopt 32-1044] Break lutnm for timing: one critical 0, two critical 0, total 0, new lutff created 0
INFO: [Physopt 32-1138] End 1 Pass. Optimized 3 nets or LUTs. Breaked 0 LUT, combined 3 existing LUTs and moved 0 existing LUT
INFO: [Physopt 32-65] No nets found for high-fanout optimization.
INFO: [Physopt 32-232] Optimized 0 net. Created 0 new instance.
INFO: [Physopt 32-775] End 1 Pass. Optimized 0 net or cell. Created 0 new cell, deleted 0 existing cell and moved 0 existing cell
INFO: [Physopt 32-670] No setup violation found.  DSP Register Optimization was not performed.
INFO: [Physopt 32-670] No setup violation found.  Shift Register to Pipeline Optimization was not performed.
INFO: [Physopt 32-670] No setup violation found.  Shift Register Optimization was not performed.
INFO: [Physopt 32-670] No setup violation found.  BRAM Register Optimization was not performed.
INFO: [Physopt 32-670] No setup violation found.  URAM Register Optimization was not performed.
INFO: [Physopt 32-949] No candidate nets found for dynamic/static region interface net replication
INFO: [Physopt 32-775] End 1 Pass. Optimized 0 net or cell. Created 0 new cell, deleted 0 existing cell and moved 0 existing cell
Netlist sorting complete. Time (s): cpu = 00:00:00 ; elapsed = 00:00:00 . Memory (MB): peak = 2705.398 ; gain = 0.000 ; free physical = 4843 ; free virtual = 10359

Summary of Physical Synthesis Optimizations
============================================


-----------------------------------------------------------------------------------------------------------------------------------------------------------
|  Optimization                                     |  Added Cells  |  Removed Cells  |  Optimized Cells/Nets  |  Dont Touch  |  Iterations  |  Elapsed   |
-----------------------------------------------------------------------------------------------------------------------------------------------------------
|  LUT Combining                                    |            0  |              3  |                     3  |           0  |           1  |  00:00:00  |
|  Retime                                           |            0  |              0  |                     0  |           0  |           1  |  00:00:00  |
|  Very High Fanout                                 |            0  |              0  |                     0  |           0  |           1  |  00:00:00  |
|  DSP Register                                     |            0  |              0  |                     0  |           0  |           0  |  00:00:00  |
|  Shift Register to Pipeline                       |            0  |              0  |                     0  |           0  |           0  |  00:00:00  |
|  Shift Register                                   |            0  |              0  |                     0  |           0  |           0  |  00:00:00  |
|  BRAM Register                                    |            0  |              0  |                     0  |           0  |           0  |  00:00:00  |
|  URAM Register                                    |            0  |              0  |                     0  |           0  |           0  |  00:00:00  |
|  Dynamic/Static Region Interface Net Replication  |            0  |              0  |                     0  |           0  |           1  |  00:00:00  |
|  Total                                            |            0  |              3  |                     3  |           0  |           4  |  00:00:00  |
-----------------------------------------------------------------------------------------------------------------------------------------------------------


Phase 2.4.2 Physical Synthesis In Placer | Checksum: b4927b8c

Time (s): cpu = 00:00:03 ; elapsed = 00:00:01 . Memory (MB): peak = 2705.398 ; gain = 0.000 ; free physical = 4843 ; free virtual = 10359
Phase 2.4 Global Placement Core | Checksum: 820c46f0

Time (s): cpu = 00:00:03 ; elapsed = 00:00:01 . Memory (MB): peak = 2705.398 ; gain = 0.000 ; free physical = 4843 ; free virtual = 10359
Phase 2 Global Placement | Checksum: 820c46f0

Time (s): cpu = 00:00:03 ; elapsed = 00:00:01 . Memory (MB): peak = 2705.398 ; gain = 0.000 ; free physical = 4843 ; free virtual = 10359

Phase 3 Detail Placement

Phase 3.1 Commit Multi Column Macros
Phase 3.1 Commit Multi Column Macros | Checksum: a59dca92

Time (s): cpu = 00:00:04 ; elapsed = 00:00:01 . Memory (MB): peak = 2705.398 ; gain = 0.000 ; free physical = 4843 ; free virtual = 10359

Phase 3.2 Commit Most Macros & LUTRAMs
Phase 3.2 Commit Most Macros & LUTRAMs | Checksum: 11dcf302b

Time (s): cpu = 00:00:04 ; elapsed = 00:00:01 . Memory (MB): peak = 2705.398 ; gain = 0.000 ; free physical = 4843 ; free virtual = 10359

Phase 3.3 Area Swap Optimization
Phase 3.3 Area Swap Optimization | Checksum: 111730d9f

Time (s): cpu = 00:00:04 ; elapsed = 00:00:01 . Memory (MB): peak = 2705.398 ; gain = 0.000 ; free physical = 4843 ; free virtual = 10359

Phase 3.4 Pipeline Register Optimization
Phase 3.4 Pipeline Register Optimization | Checksum: 5b616aa1

Time (s): cpu = 00:00:04 ; elapsed = 00:00:01 . Memory (MB): peak = 2705.398 ; gain = 0.000 ; free physical = 4843 ; free virtual = 10359

Phase 3.5 Small Shape Detail Placement
Phase 3.5 Small Shape Detail Placement | Checksum: 10b0dcb78

Time (s): cpu = 00:00:04 ; elapsed = 00:00:01 . Memory (MB): peak = 2705.398 ; gain = 0.000 ; free physical = 4838 ; free virtual = 10354

Phase 3.6 Re-assign LUT pins
Phase 3.6 Re-assign LUT pins | Checksum: 12119849e

Time (s): cpu = 00:00:04 ; elapsed = 00:00:01 . Memory (MB): peak = 2705.398 ; gain = 0.000 ; free physical = 4838 ; free virtual = 10354

Phase 3.7 Pipeline Register Optimization
Phase 3.7 Pipeline Register Optimization | Checksum: 1daf8279c

Time (s): cpu = 00:00:04 ; elapsed = 00:00:01 . Memory (MB): peak = 2705.398 ; gain = 0.000 ; free physical = 4838 ; free virtual = 10354
Phase 3 Detail Placement | Checksum: 1daf8279c

Time (s): cpu = 00:00:04 ; elapsed = 00:00:01 . Memory (MB): peak = 2705.398 ; gain = 0.000 ; free physical = 4838 ; free virtual = 10354

Phase 4 Post Placement Optimization and Clean-Up

Phase 4.1 Post Commit Optimization
INFO: [Timing 38-35] Done setting XDC timing constraints.

Phase 4.1.1 Post Placement Optimization
Post Placement Optimization Initialization | Checksum: 28bdce896

Phase 4.1.1.1 BUFG Insertion

Starting Physical Synthesis Task

Phase 1 Physical Synthesis Initialization
INFO: [Physopt 32-721] Multithreading enabled for phys_opt_design using a maximum of 8 CPUs
INFO: [Physopt 32-619] Estimated Timing Summary | WNS=3.648 | TNS=0.000 |
Phase 1 Physical Synthesis Initialization | Checksum: 2219f9024

Time (s): cpu = 00:00:00.02 ; elapsed = 00:00:00.01 . Memory (MB): peak = 2705.398 ; gain = 0.000 ; free physical = 4837 ; free virtual = 10353
INFO: [Place 46-56] BUFG insertion identified 0 candidate nets. Inserted BUFG: 0, Replicated BUFG Driver: 0, Skipped due to Placement/Routing Conflicts: 0, Skipped due to Timing Degradation: 0, Skipped due to Illegal Netlist: 0.
Ending Physical Synthesis Task | Checksum: 25f48ce02

Time (s): cpu = 00:00:00.02 ; elapsed = 00:00:00.01 . Memory (MB): peak = 2705.398 ; gain = 0.000 ; free physical = 4837 ; free virtual = 10353
Phase 4.1.1.1 BUFG Insertion | Checksum: 28bdce896

Time (s): cpu = 00:00:04 ; elapsed = 00:00:01 . Memory (MB): peak = 2705.398 ; gain = 0.000 ; free physical = 4837 ; free virtual = 10353

Phase 4.1.1.2 Post Placement Timing Optimization
INFO: [Place 30-746] Post Placement Timing Summary WNS=3.648. For the most accurate timing information please run report_timing.
Phase 4.1.1.2 Post Placement Timing Optimization | Checksum: 2625f2995

Time (s): cpu = 00:00:04 ; elapsed = 00:00:01 . Memory (MB): peak = 2705.398 ; gain = 0.000 ; free physical = 4837 ; free virtual = 10353

Time (s): cpu = 00:00:04 ; elapsed = 00:00:01 . Memory (MB): peak = 2705.398 ; gain = 0.000 ; free physical = 4837 ; free virtual = 10353
Phase 4.1 Post Commit Optimization | Checksum: 2625f2995

Time (s): cpu = 00:00:04 ; elapsed = 00:00:01 . Memory (MB): peak = 2705.398 ; gain = 0.000 ; free physical = 4837 ; free virtual = 10353

Phase 4.2 Post Placement Cleanup
Phase 4.2 Post Placement Cleanup | Checksum: 2625f2995

Time (s): cpu = 00:00:04 ; elapsed = 00:00:01 . Memory (MB): peak = 2705.398 ; gain = 0.000 ; free physical = 4837 ; free virtual = 10353

Phase 4.3 Placer Reporting

Phase 4.3.1 Print Estimated Congestion
INFO: [Place 30-612] Post-Placement Estimated Congestion 
 ____________________________________________________
|           | Global Congestion | Short Congestion  |
| Direction | Region Size       | Region Size       |
|___________|___________________|___________________|
|      North|                1x1|                1x1|
|___________|___________________|___________________|
|      South|                1x1|                1x1|
|___________|___________________|___________________|
|       East|                1x1|                1x1|
|___________|___________________|___________________|
|       West|                1x1|                1x1|
|___________|___________________|___________________|

Phase 4.3.1 Print Estimated Congestion | Checksum: 2625f2995

Time (s): cpu = 00:00:04 ; elapsed = 00:00:01 . Memory (MB): peak = 2705.398 ; gain = 0.000 ; free physical = 4837 ; free virtual = 10353
Phase 4.3 Placer Reporting | Checksum: 2625f2995

Time (s): cpu = 00:00:04 ; elapsed = 00:00:01 . Memory (MB): peak = 2705.398 ; gain = 0.000 ; free physical = 4837 ; free virtual = 10353

Phase 4.4 Final Placement Cleanup
Netlist sorting complete. Time (s): cpu = 00:00:00 ; elapsed = 00:00:00 . Memory (MB): peak = 2705.398 ; gain = 0.000 ; free physical = 4837 ; free virtual = 10353

Time (s): cpu = 00:00:04 ; elapsed = 00:00:01 . Memory (MB): peak = 2705.398 ; gain = 0.000 ; free physical = 4837 ; free virtual = 10353
Phase 4 Post Placement Optimization and Clean-Up | Checksum: 24c931d77

Time (s): cpu = 00:00:04 ; elapsed = 00:00:01 . Memory (MB): peak = 2705.398 ; gain = 0.000 ; free physical = 4837 ; free virtual = 10353
Ending Placer Task | Checksum: 1c322770a

Time (s): cpu = 00:00:04 ; elapsed = 00:00:01 . Memory (MB): peak = 2705.398 ; gain = 0.000 ; free physical = 4837 ; free virtual = 10353
INFO: [Common 17-83] Releasing license: Implementation
65 Infos, 71 Warnings, 71 Critical Warnings and 0 Errors encountered.
place_design completed successfully
INFO: [Timing 38-480] Writing timing data to binary archive.
Writing XDEF routing.
Writing XDEF routing logical nets.
Writing XDEF routing special nets.
Write XDEF Complete: Time (s): cpu = 00:00:00.09 ; elapsed = 00:00:00.03 . Memory (MB): peak = 2705.398 ; gain = 0.000 ; free physical = 4848 ; free virtual = 10365
INFO: [Common 17-1381] The checkpoint '/home/ece385user/Documents/ece385/lab4/lab3.runs/impl_1/multiplier_toplevel_placed.dcp' has been generated.
INFO: [runtcl-4] Executing : report_io -file multiplier_toplevel_io_placed.rpt
report_io: Time (s): cpu = 00:00:00.08 ; elapsed = 00:00:00.16 . Memory (MB): peak = 2705.398 ; gain = 0.000 ; free physical = 4816 ; free virtual = 10332
INFO: [runtcl-4] Executing : report_utilization -file multiplier_toplevel_utilization_placed.rpt -pb multiplier_toplevel_utilization_placed.pb
INFO: [runtcl-4] Executing : report_control_sets -verbose -file multiplier_toplevel_control_sets_placed.rpt
report_control_sets: Time (s): cpu = 00:00:00.02 ; elapsed = 00:00:00.1 . Memory (MB): peak = 2705.398 ; gain = 0.000 ; free physical = 4819 ; free virtual = 10335
Command: phys_opt_design
Attempting to get a license for feature 'Implementation' and/or device 'xc7s50'
INFO: [Common 17-349] Got license for feature 'Implementation' and/or device 'xc7s50'

Starting Initial Update Timing Task

Time (s): cpu = 00:00:00.08 ; elapsed = 00:00:00.06 . Memory (MB): peak = 2705.398 ; gain = 0.000 ; free physical = 4795 ; free virtual = 10312
INFO: [Vivado_Tcl 4-383] Design worst setup slack (WNS) is greater than or equal to 0.000 ns. Skipping all physical synthesis optimizations.
INFO: [Vivado_Tcl 4-232] No setup violation found. The netlist was not modified.
INFO: [Common 17-83] Releasing license: Implementation
74 Infos, 71 Warnings, 71 Critical Warnings and 0 Errors encountered.
phys_opt_design completed successfully
INFO: [Timing 38-480] Writing timing data to binary archive.
Writing XDEF routing.
Writing XDEF routing logical nets.
Writing XDEF routing special nets.
Write XDEF Complete: Time (s): cpu = 00:00:00.09 ; elapsed = 00:00:00.03 . Memory (MB): peak = 2705.398 ; gain = 0.000 ; free physical = 4791 ; free virtual = 10308
INFO: [Common 17-1381] The checkpoint '/home/ece385user/Documents/ece385/lab4/lab3.runs/impl_1/multiplier_toplevel_physopt.dcp' has been generated.
Command: route_design
Attempting to get a license for feature 'Implementation' and/or device 'xc7s50'
INFO: [Common 17-349] Got license for feature 'Implementation' and/or device 'xc7s50'
Running DRC as a precondition to command route_design
INFO: [DRC 23-27] Running DRC with 8 threads
INFO: [Vivado_Tcl 4-198] DRC finished with 0 Errors
INFO: [Vivado_Tcl 4-199] Please refer to the DRC report (report_drc) for more information.


Starting Routing Task
INFO: [Route 35-254] Multithreading enabled for route_design using a maximum of 8 CPUs

Phase 1 Build RT Design
Checksum: PlaceDB: f097a34c ConstDB: 0 ShapeSum: d28ad3be RouteDB: 0
Post Restoration Checksum: NetGraph: bcaaeedf NumContArr: 324d6a8d Constraints: 0 Timing: 0
Phase 1 Build RT Design | Checksum: eef8596c

Time (s): cpu = 00:00:13 ; elapsed = 00:00:11 . Memory (MB): peak = 2719.918 ; gain = 14.520 ; free physical = 4685 ; free virtual = 10202

Phase 2 Router Initialization

Phase 2.1 Fix Topology Constraints
Phase 2.1 Fix Topology Constraints | Checksum: eef8596c

Time (s): cpu = 00:00:13 ; elapsed = 00:00:11 . Memory (MB): peak = 2757.918 ; gain = 52.520 ; free physical = 4646 ; free virtual = 10163

Phase 2.2 Pre Route Cleanup
Phase 2.2 Pre Route Cleanup | Checksum: eef8596c

Time (s): cpu = 00:00:13 ; elapsed = 00:00:11 . Memory (MB): peak = 2757.918 ; gain = 52.520 ; free physical = 4646 ; free virtual = 10163
 Number of Nodes with overlaps = 0

Phase 2.3 Update Timing
Phase 2.3 Update Timing | Checksum: 124e84cbf

Time (s): cpu = 00:00:13 ; elapsed = 00:00:11 . Memory (MB): peak = 2770.918 ; gain = 65.520 ; free physical = 4642 ; free virtual = 10159
INFO: [Route 35-416] Intermediate Timing Summary | WNS=3.723  | TNS=0.000  | WHS=-0.082 | THS=-2.165 |


Router Utilization Summary
  Global Vertical Routing Utilization    = 0 %
  Global Horizontal Routing Utilization  = 0 %
  Routable Net Status*
  *Does not include unroutable nets such as driverless and loadless.
  Run report_route_status for detailed report.
  Number of Failed Nets               = 375
    (Failed Nets is the sum of unrouted and partially routed nets)
  Number of Unrouted Nets             = 375
  Number of Partially Routed Nets     = 0
  Number of Node Overlaps             = 0

Phase 2 Router Initialization | Checksum: f5d4bbd0

Time (s): cpu = 00:00:14 ; elapsed = 00:00:11 . Memory (MB): peak = 2773.918 ; gain = 68.520 ; free physical = 4637 ; free virtual = 10154

Phase 3 Initial Routing

Phase 3.1 Global Routing
Phase 3.1 Global Routing | Checksum: f5d4bbd0

Time (s): cpu = 00:00:14 ; elapsed = 00:00:11 . Memory (MB): peak = 2773.918 ; gain = 68.520 ; free physical = 4637 ; free virtual = 10154
Phase 3 Initial Routing | Checksum: 17d0896c9

Time (s): cpu = 00:00:14 ; elapsed = 00:00:12 . Memory (MB): peak = 2773.918 ; gain = 68.520 ; free physical = 4640 ; free virtual = 10157

Phase 4 Rip-up And Reroute

Phase 4.1 Global Iteration 0
 Number of Nodes with overlaps = 9
 Number of Nodes with overlaps = 1
 Number of Nodes with overlaps = 0
INFO: [Route 35-416] Intermediate Timing Summary | WNS=3.732  | TNS=0.000  | WHS=N/A    | THS=N/A    |

Phase 4.1 Global Iteration 0 | Checksum: d92c075f

Time (s): cpu = 00:00:14 ; elapsed = 00:00:12 . Memory (MB): peak = 2773.918 ; gain = 68.520 ; free physical = 4641 ; free virtual = 10158
Phase 4 Rip-up And Reroute | Checksum: d92c075f

Time (s): cpu = 00:00:14 ; elapsed = 00:00:12 . Memory (MB): peak = 2773.918 ; gain = 68.520 ; free physical = 4641 ; free virtual = 10158

Phase 5 Delay and Skew Optimization

Phase 5.1 Delay CleanUp

Phase 5.1.1 Update Timing
Phase 5.1.1 Update Timing | Checksum: e20d9178

Time (s): cpu = 00:00:14 ; elapsed = 00:00:12 . Memory (MB): peak = 2773.918 ; gain = 68.520 ; free physical = 4641 ; free virtual = 10158
INFO: [Route 35-416] Intermediate Timing Summary | WNS=3.826  | TNS=0.000  | WHS=N/A    | THS=N/A    |

Phase 5.1 Delay CleanUp | Checksum: e20d9178

Time (s): cpu = 00:00:14 ; elapsed = 00:00:12 . Memory (MB): peak = 2773.918 ; gain = 68.520 ; free physical = 4641 ; free virtual = 10158

Phase 5.2 Clock Skew Optimization
Phase 5.2 Clock Skew Optimization | Checksum: e20d9178

Time (s): cpu = 00:00:14 ; elapsed = 00:00:12 . Memory (MB): peak = 2773.918 ; gain = 68.520 ; free physical = 4641 ; free virtual = 10158
Phase 5 Delay and Skew Optimization | Checksum: e20d9178

Time (s): cpu = 00:00:14 ; elapsed = 00:00:12 . Memory (MB): peak = 2773.918 ; gain = 68.520 ; free physical = 4641 ; free virtual = 10158

Phase 6 Post Hold Fix

Phase 6.1 Hold Fix Iter

Phase 6.1.1 Update Timing
Phase 6.1.1 Update Timing | Checksum: 15ce5271d

Time (s): cpu = 00:00:14 ; elapsed = 00:00:12 . Memory (MB): peak = 2773.918 ; gain = 68.520 ; free physical = 4641 ; free virtual = 10158
INFO: [Route 35-416] Intermediate Timing Summary | WNS=3.826  | TNS=0.000  | WHS=0.167  | THS=0.000  |

Phase 6.1 Hold Fix Iter | Checksum: d88b423b

Time (s): cpu = 00:00:14 ; elapsed = 00:00:12 . Memory (MB): peak = 2773.918 ; gain = 68.520 ; free physical = 4641 ; free virtual = 10158
Phase 6 Post Hold Fix | Checksum: d88b423b

Time (s): cpu = 00:00:14 ; elapsed = 00:00:12 . Memory (MB): peak = 2773.918 ; gain = 68.520 ; free physical = 4641 ; free virtual = 10158

Phase 7 Route finalize

Router Utilization Summary
  Global Vertical Routing Utilization    = 0.0766164 %
  Global Horizontal Routing Utilization  = 0.151614 %
  Routable Net Status*
  *Does not include unroutable nets such as driverless and loadless.
  Run report_route_status for detailed report.
  Number of Failed Nets               = 0
    (Failed Nets is the sum of unrouted and partially routed nets)
  Number of Unrouted Nets             = 0
  Number of Partially Routed Nets     = 0
  Number of Node Overlaps             = 0

Phase 7 Route finalize | Checksum: 18a302c5b

Time (s): cpu = 00:00:14 ; elapsed = 00:00:12 . Memory (MB): peak = 2773.918 ; gain = 68.520 ; free physical = 4641 ; free virtual = 10158

Phase 8 Verifying routed nets

 Verification completed successfully
Phase 8 Verifying routed nets | Checksum: 18a302c5b

Time (s): cpu = 00:00:14 ; elapsed = 00:00:12 . Memory (MB): peak = 2773.918 ; gain = 68.520 ; free physical = 4641 ; free virtual = 10158

Phase 9 Depositing Routes
Phase 9 Depositing Routes | Checksum: 12e3d7f79

Time (s): cpu = 00:00:14 ; elapsed = 00:00:12 . Memory (MB): peak = 2789.926 ; gain = 84.527 ; free physical = 4641 ; free virtual = 10158

Phase 10 Post Router Timing
INFO: [Route 35-57] Estimated Timing Summary | WNS=3.826  | TNS=0.000  | WHS=0.167  | THS=0.000  |

INFO: [Route 35-327] The final timing numbers are based on the router estimated timing analysis. For a complete and accurate timing signoff, please run report_timing_summary.
Phase 10 Post Router Timing | Checksum: 12e3d7f79

Time (s): cpu = 00:00:14 ; elapsed = 00:00:12 . Memory (MB): peak = 2789.926 ; gain = 84.527 ; free physical = 4641 ; free virtual = 10158
INFO: [Route 35-16] Router Completed Successfully

Time (s): cpu = 00:00:14 ; elapsed = 00:00:12 . Memory (MB): peak = 2789.926 ; gain = 84.527 ; free physical = 4669 ; free virtual = 10186

Routing Is Done.
INFO: [Common 17-83] Releasing license: Implementation
89 Infos, 71 Warnings, 71 Critical Warnings and 0 Errors encountered.
route_design completed successfully
route_design: Time (s): cpu = 00:00:15 ; elapsed = 00:00:12 . Memory (MB): peak = 2789.926 ; gain = 84.527 ; free physical = 4669 ; free virtual = 10186
INFO: [Timing 38-480] Writing timing data to binary archive.
Writing XDEF routing.
Writing XDEF routing logical nets.
Writing XDEF routing special nets.
Write XDEF Complete: Time (s): cpu = 00:00:00.1 ; elapsed = 00:00:00.04 . Memory (MB): peak = 2789.926 ; gain = 0.000 ; free physical = 4667 ; free virtual = 10185
INFO: [Common 17-1381] The checkpoint '/home/ece385user/Documents/ece385/lab4/lab3.runs/impl_1/multiplier_toplevel_routed.dcp' has been generated.
INFO: [runtcl-4] Executing : report_drc -file multiplier_toplevel_drc_routed.rpt -pb multiplier_toplevel_drc_routed.pb -rpx multiplier_toplevel_drc_routed.rpx
Command: report_drc -file multiplier_toplevel_drc_routed.rpt -pb multiplier_toplevel_drc_routed.pb -rpx multiplier_toplevel_drc_routed.rpx
INFO: [IP_Flow 19-1839] IP Catalog is up to date.
INFO: [DRC 23-27] Running DRC with 8 threads
INFO: [Vivado_Tcl 2-168] The results of DRC are in file /home/ece385user/Documents/ece385/lab4/lab3.runs/impl_1/multiplier_toplevel_drc_routed.rpt.
report_drc completed successfully
INFO: [runtcl-4] Executing : report_methodology -file multiplier_toplevel_methodology_drc_routed.rpt -pb multiplier_toplevel_methodology_drc_routed.pb -rpx multiplier_toplevel_methodology_drc_routed.rpx
Command: report_methodology -file multiplier_toplevel_methodology_drc_routed.rpt -pb multiplier_toplevel_methodology_drc_routed.pb -rpx multiplier_toplevel_methodology_drc_routed.rpx
INFO: [Timing 38-35] Done setting XDC timing constraints.
INFO: [DRC 23-133] Running Methodology with 8 threads
INFO: [Vivado_Tcl 2-1520] The results of Report Methodology are in file /home/ece385user/Documents/ece385/lab4/lab3.runs/impl_1/multiplier_toplevel_methodology_drc_routed.rpt.
report_methodology completed successfully
INFO: [runtcl-4] Executing : report_power -file multiplier_toplevel_power_routed.rpt -pb multiplier_toplevel_power_summary_routed.pb -rpx multiplier_toplevel_power_routed.rpx
Command: report_power -file multiplier_toplevel_power_routed.rpt -pb multiplier_toplevel_power_summary_routed.pb -rpx multiplier_toplevel_power_routed.rpx
INFO: [Timing 38-35] Done setting XDC timing constraints.
Running Vector-less Activity Propagation...

Finished Running Vector-less Activity Propagation
101 Infos, 71 Warnings, 71 Critical Warnings and 0 Errors encountered.
report_power completed successfully
INFO: [runtcl-4] Executing : report_route_status -file multiplier_toplevel_route_status.rpt -pb multiplier_toplevel_route_status.pb
INFO: [runtcl-4] Executing : report_timing_summary -max_paths 10 -report_unconstrained -file multiplier_toplevel_timing_summary_routed.rpt -pb multiplier_toplevel_timing_summary_routed.pb -rpx multiplier_toplevel_timing_summary_routed.rpx -warn_on_violation 
INFO: [Timing 38-91] UpdateTimingParams: Speed grade: -1, Delay Type: min_max.
INFO: [Timing 38-191] Multithreading enabled for timing update using a maximum of 8 CPUs
INFO: [runtcl-4] Executing : report_incremental_reuse -file multiplier_toplevel_incremental_reuse_routed.rpt
INFO: [Vivado_Tcl 4-1062] Incremental flow is disabled. No incremental reuse Info to report.
INFO: [runtcl-4] Executing : report_clock_utilization -file multiplier_toplevel_clock_utilization_routed.rpt
INFO: [runtcl-4] Executing : report_bus_skew -warn_on_violation -file multiplier_toplevel_bus_skew_routed.rpt -pb multiplier_toplevel_bus_skew_routed.pb -rpx multiplier_toplevel_bus_skew_routed.rpx
INFO: [Timing 38-91] UpdateTimingParams: Speed grade: -1, Delay Type: min_max.
INFO: [Timing 38-191] Multithreading enabled for timing update using a maximum of 8 CPUs
Command: write_bitstream -force multiplier_toplevel.bit
Attempting to get a license for feature 'Implementation' and/or device 'xc7s50'
INFO: [Common 17-349] Got license for feature 'Implementation' and/or device 'xc7s50'
Running DRC as a precondition to command write_bitstream
INFO: [IP_Flow 19-1839] IP Catalog is up to date.
INFO: [DRC 23-27] Running DRC with 8 threads
WARNING: [DRC CFGBVS-1] Missing CFGBVS and CONFIG_VOLTAGE Design Properties: Neither the CFGBVS nor CONFIG_VOLTAGE voltage property is set in the current_design.  Configuration bank voltage select (CFGBVS) must be set to VCCO or GND, and CONFIG_VOLTAGE must be set to the correct configuration voltage, in order to determine the I/O voltage support for the pins in bank 0.  It is suggested to specify these either using the 'Edit Device Properties' function in the GUI or directly in the XDC file using the following syntax:

 set_property CFGBVS value1 [current_design]
 #where value1 is either VCCO or GND

 set_property CONFIG_VOLTAGE value2 [current_design]
 #where value2 is the voltage provided to configuration bank 0

Refer to the device configuration user guide for more information.
INFO: [Vivado 12-3199] DRC finished with 0 Errors, 1 Warnings
INFO: [Vivado 12-3200] Please refer to the DRC report (report_drc) for more information.
INFO: [Designutils 20-2272] Running write_bitstream with 8 threads.
Loading data files...
Loading site data...
Loading route data...
Processing options...
Creating bitmap...
Creating bitstream...
Writing bitstream ./multiplier_toplevel.bit...
INFO: [Vivado 12-1842] Bitgen Completed Successfully.
INFO: [Project 1-1876] WebTalk data collection is mandatory when using a ULT device. To see the specific WebTalk data collected for your design, open the usage_statistics_webtalk.html or usage_statistics_webtalk.xml file in the implementation directory.
INFO: [Common 17-83] Releasing license: Implementation
12 Infos, 1 Warnings, 0 Critical Warnings and 0 Errors encountered.
write_bitstream completed successfully
write_bitstream: Time (s): cpu = 00:00:08 ; elapsed = 00:00:10 . Memory (MB): peak = 3113.906 ; gain = 225.316 ; free physical = 4549 ; free virtual = 10069
INFO: [Common 17-206] Exiting Vivado at Tue Feb 17 19:30:52 2026...

*** Running vivado
    with args -log multiplier_toplevel.vdi -applog -m64 -product Vivado -messageDb vivado.pb -mode batch -source multiplier_toplevel.tcl -notrace


****** Vivado v2022.2 (64-bit)
  **** SW Build 3671981 on Fri Oct 14 04:59:54 MDT 2022
  **** IP Build 3669848 on Fri Oct 14 08:30:02 MDT 2022
    ** Copyright 1986-2022 Xilinx, Inc. All Rights Reserved.

source multiplier_toplevel.tcl -notrace
Command: open_checkpoint multiplier_toplevel_routed.dcp
INFO: [Device 21-403] Loading part xc7s50csga324-1
Netlist sorting complete. Time (s): cpu = 00:00:00 ; elapsed = 00:00:00 . Memory (MB): peak = 1661.469 ; gain = 0.000 ; free physical = 8065 ; free virtual = 14157
INFO: [Netlist 29-17] Analyzing 45 Unisim elements for replacement
INFO: [Netlist 29-28] Unisim Transformation completed in 0 CPU seconds
INFO: [Project 1-479] Netlist was created with Vivado 2022.2
INFO: [Project 1-570] Preparing netlist for logic optimization
INFO: [Timing 38-478] Restoring timing data from binary archive.
INFO: [Timing 38-479] Binary timing data restore complete.
INFO: [Project 1-856] Restoring constraints from binary archive.
INFO: [Constraints 18-5170] The checkpoint was created with non-default parameter values which do not match the current Vivado settings.  Mismatching parameters are:
  tcl.collectionResultDisplayLimit
INFO: [Project 1-853] Binary constraint restore complete.
Reading XDEF placement.
Reading placer database...
Reading XDEF routing.
Read XDEF Files: Time (s): cpu = 00:00:00.05 ; elapsed = 00:00:00.07 . Memory (MB): peak = 2230.461 ; gain = 6.938 ; free physical = 7622 ; free virtual = 13714
Restored from archive | CPU: 0.060000 secs | Memory: 1.665924 MB |
Finished XDEF File Restore: Time (s): cpu = 00:00:00.05 ; elapsed = 00:00:00.07 . Memory (MB): peak = 2230.461 ; gain = 6.938 ; free physical = 7622 ; free virtual = 13714
Netlist sorting complete. Time (s): cpu = 00:00:00 ; elapsed = 00:00:00 . Memory (MB): peak = 2230.461 ; gain = 0.000 ; free physical = 7622 ; free virtual = 13714
INFO: [Project 1-111] Unisim Transformation Summary:
No Unisim elements were transformed.

INFO: [Project 1-604] Checkpoint was created with Vivado v2022.2 (64-bit) build 3671981
OpenCheckpoint Checksum | Checksum: 198eee48b
----- Checksum: PlaceDB: 1ff810cb ShapeSum: d28ad3be RouteDB: a66c0002 
open_checkpoint: Time (s): cpu = 00:00:11 ; elapsed = 00:00:12 . Memory (MB): peak = 2230.461 ; gain = 824.234 ; free physical = 7622 ; free virtual = 13714
Command: write_bitstream -force multiplier_toplevel.bit
Attempting to get a license for feature 'Implementation' and/or device 'xc7s50'
INFO: [Common 17-349] Got license for feature 'Implementation' and/or device 'xc7s50'
Running DRC as a precondition to command write_bitstream
INFO: [IP_Flow 19-234] Refreshing IP repositories
INFO: [IP_Flow 19-1704] No user IP repositories specified
INFO: [IP_Flow 19-2313] Loaded Vivado IP repository '/tools/Xilinx/Vivado/2022.2/data/ip'.
INFO: [DRC 23-27] Running DRC with 8 threads
WARNING: [DRC CFGBVS-1] Missing CFGBVS and CONFIG_VOLTAGE Design Properties: Neither the CFGBVS nor CONFIG_VOLTAGE voltage property is set in the current_design.  Configuration bank voltage select (CFGBVS) must be set to VCCO or GND, and CONFIG_VOLTAGE must be set to the correct configuration voltage, in order to determine the I/O voltage support for the pins in bank 0.  It is suggested to specify these either using the 'Edit Device Properties' function in the GUI or directly in the XDC file using the following syntax:

 set_property CFGBVS value1 [current_design]
 #where value1 is either VCCO or GND

 set_property CONFIG_VOLTAGE value2 [current_design]
 #where value2 is the voltage provided to configuration bank 0

Refer to the device configuration user guide for more information.
INFO: [Vivado 12-3199] DRC finished with 0 Errors, 1 Warnings
INFO: [Vivado 12-3200] Please refer to the DRC report (report_drc) for more information.
INFO: [Designutils 20-2272] Running write_bitstream with 8 threads.
Loading data files...
Loading site data...
Loading route data...
Processing options...
Creating bitmap...
Creating bitstream...
Writing bitstream ./multiplier_toplevel.bit...
INFO: [Vivado 12-1842] Bitgen Completed Successfully.
INFO: [Project 1-1876] WebTalk data collection is mandatory when using a ULT device. To see the specific WebTalk data collected for your design, open the usage_statistics_webtalk.html or usage_statistics_webtalk.xml file in the implementation directory.
INFO: [Common 17-83] Releasing license: Implementation
23 Infos, 1 Warnings, 0 Critical Warnings and 0 Errors encountered.
write_bitstream completed successfully
write_bitstream: Time (s): cpu = 00:00:07 ; elapsed = 00:00:09 . Memory (MB): peak = 2687.348 ; gain = 456.887 ; free physical = 7473 ; free virtual = 13567
INFO: [Common 17-206] Exiting Vivado at Thu Feb 19 22:49:30 2026...
